{
  "$schema": "./config.schema.json",
  "client": {
    "id": "835856785512464436",
    "token": "YOUR_BOT_TOKEN",
    "refuse_unknown_command_interactions": false,
    "suppress_unknown_interaction_warnings": false,
    "development_server_id": "FOR_DEVELOPERS_ONLY",
    "command_usage_channel_id": "",
    "error_channel_id": "",
    "presence": {
      "active": true,
      "status": "online",
      "activities": [
        {
          "name": "with the API",
          "type": "PLAYING",
          "url": ""
        }
      ]
    }
  },
  "permissions": {
    "owner_id": "1148597817498140774",
    "developer_ids": [
      "1148597817498140774"
    ],
    "system_administrator_ids": [
      "1148597817498140774"
    ],
    "default_lock_member_permissions": false
  },
  "api": {
    "enabled": true,
    "port": 9000
  },
  "cooldown": {
    "default_cooldown_enabled": true,
    "default_cooldown_type": "User",
    "default_cooldown_usages": 2,
    "default_cooldown_duration": 15,
    "default_cooldown_persistent": false
  },
  "cluster": {
    "enabled": false,
    "total_shards": 2,
    "shards_per_clusters": 1,
    "total_clusters": 2,
    "mode": "process",
    "respawn": true,
    "restarts": {
      "max": 1,
      "interval": 5000
    }
  },
  "colors": {
    "primary": "#91DDF2",
    "secondary": "#99aab5",
    "success": "#57F287",
    "error": "#dd2e44",
    "info": "#3b88c3",
    "warning": "#ffcc4d",
    "debug": "#9266cc",
    "waiting": "#f7b977"
  },
  "emojis": {
    "success": "‚úÖ",
    "error": "‚ùå",
    "info": ":information_source:",
    "warning": "‚ö†Ô∏è",
    "debug": "üêõ",
    "waiting": "‚è≥",
    "separator": "‚Ä¢"
  },
  "debug": {
    "debug_mode_enabled": true,
    "chat_input_command_api_data": true,
    "interactions": true,
    "autocomplete_execution_time": true,
    "modal_submit_execution_time": true,
    "command_throttling": true,
    "localizations": false,
    "command_data": true
  },
  "urls": {
    "github": "https://github.com/Mirasaki/ts-discord-template",
    "docs": "https://dts.mirasaki.dev",
    "website": "https://mirasaki.dev",
    "support_server": "https://discord.gg/mirasaki  "
  },
  "logging": {
    "max_size": "5m",
    "max_files": "14d",
    "zipped_archive": true,
    "directory": "logs",
    "date_pattern": "YYYY-MM-DD",
    "combined_logging": true,
    "error_logging": true,
    "warn_logging": true,
    "info_logging": true,
    "http_logging": true,
    "verbose_logging": true,
    "debug_logging": true,
    "silly_logging": true
  }
}